Name,Description,Example
acquisition_instrument_model,Manufacturers of an acquisition instrument may offer various versions (models) of that instrument with different features or sensitivities. Differences in features or sensitivities may be relevant to processing or interpretation of the data.,
acquisition_instrument_vendor,An acquisition instrument is the device that contains the signal detection hardware and signal processing software. Assays generate signals such as light of various intensities or color or signals representing the molecular mass.,
analyte_class,,
assay_category,,
assay_type,The UMI sequence length in the 10xGenomics-v2 kit is 10 base pairs and the length in the 10xGenomics-v3 kit is 12 base pairs.,
cell_barcode_offset,Position(s) in the read at which the cell barcode starts.,"0,0,38,76"
cell_barcode_read,"Which read file(s) contains the cell barcode. Multiple cell_barcode_read files must be provided as a comma-delimited list (e.g. file1,file2,file3).",
cell_barcode_size,Length of the cell barcode in base pairs,"16,8,8,8"
contributors_path,Relative path to file with ORCID IDs for contributors for this dataset.,
data_path,Relative path to file or directory with instrument data. Downstream processing will depend on filename extension conventions.,
description,Free-text description of this assay.,
donor_id,HuBMAP Display ID of the donor of the assayed tissue.,ABC123
execution_datetime,"Start date and time of assay, typically a date-time stamped folder generated by the acquisition instrument. YYYY-MM-DD hh:mm, where YYYY is the year, MM is the month with leading 0s, and DD is the day with leading 0s, hh is the hour with leading zeros, mm are the minutes with leading zeros.",
expected_cell_count,How many cells are expected? This may be used in downstream pipelines to guide selection of cell barcodes or segmentation parameters.,
is_targeted,Specifies whether or not a specific molecule(s) is/are targeted for detection/measurement by the assay.,
is_technical_replicate,"Is the sequencing reaction run in replicate, TRUE or FALSE",
library_adapter_sequence,Adapter sequence to be used for adapter trimming,CTGTCTCTTATACACATCT
library_average_fragment_size,Average size in basepairs (bp) of sequencing library fragments estimated via gel electrophoresis or bioanalyzer/tapestation.,
library_construction_protocols_io_doi,"A link to the protocol document containing the library construction method (including version) that was used, e.g. ""Smart-Seq2"", ""Drop-Seq"", ""10X v3"".",
library_final_yield_unit,Units of final library yield,
library_final_yield_value,Total number of ng of library after final pcr amplification step. This is the concentration (ng/ul) * volume (ul),
library_id,"A library ID, unique within a TMC, which allows corresponding RNA and chromatin accessibility datasets to be linked.",
library_layout,State whether the library was generated for single-end or paired end sequencing.,
library_pcr_cycles,Number of PCR cycles to amplify cDNA,
library_pcr_cycles_for_sample_index,Number of PCR cycles performed for library indexing,
operator,Name of the person responsible for executing the assay.,
operator_email,Email address for the operator.,
pi,Name of the principal investigator responsible for the data.,
pi_email,Email address for the principal investigator.,
protocols_io_doi,DOI for protocols.io referring to the protocol for this assay.,
rnaseq_assay_input,Number of cell/nuclei input to the assay,
rnaseq_assay_method,The kit used for the RNA sequencing assay,
sc_isolation_cell_number,Total number of cell/nuclei yielded post dissociation and enrichment,
sc_isolation_enrichment,The method by which specific cell populations are sorted or enriched.,
sc_isolation_entity,The type of single cell entity derived from isolation protocol,
sc_isolation_protocols_io_doi,Link to a protocols document answering the question: How were single cells separated into a single-cell suspension?,
sc_isolation_quality_metric,A quality metric by visual inspection prior to cell lysis or defined by known parameters such as wells with several cells or no cells. This can be captured at a high level.,
sc_isolation_tissue_dissociation,The method by which tissues are dissociated into single cells in suspension.,
sequencing_phix_percent,Percent PhiX loaded to the run,
sequencing_read_format,"Slash-delimited list of the number of sequencing cycles for, for example, Read1, i7 index, i5 index, and Read2.",12/34/56
sequencing_read_percent_q30,Q30 is the weighted average of all the reads (e.g. # bases UMI * q30 UMI + # bases R2 * q30 R2 + ...),
sequencing_reagent_kit,Reagent kit used for sequencing,
tissue_id,HuBMAP Display ID of the assayed tissue.,ABC123-BL-1-2-3_456
umi_offset,Position in the read at which the umi barcode starts.,
umi_read,Which read file(s) contains the UMI (unique molecular identifier) barcode.,R1
umi_size,Length of the umi barcode in base pairs.,
version,Version of the schema to use when validating this metadata.,
